{
  "schema_version": "1.0",
  "provenance_id": "hero-male-ai-pilot-provenance",
  "task_id": "mission-1.17.5-ai-pilot",
  "scene": "hero-male-ai-pilot",
  "created_at": "2026-08-14T00:00:00Z",
  "asset": {
    "id": "hero-male-ai-pilot",
    "path": "hero-male.json",
    "type": "runtime-pilot",
    "framework": "body-rig",
    "version": "0.1.0"
  },
  "authority": "ai_generated",
  "readiness": "runtime_ready",
  "generator": {
    "model": "declared-by-agent-at-generation-time",
    "task_id": "mission-1.17.5-ai-pilot",
    "source": "agent-created-pilot",
    "generated_at": "2026-08-14T00:00:00Z",
    "agent": "codex"
  },
  "license": {
    "spdx": "UNLICENSED",
    "source": "internal-generation",
    "attribution": "Generated pilot retained for runtime testing; production distribution requires a separate rights decision."
  },
  "files": [
    {
      "path": "hero-male.json",
      "role": "runtime-pilot",
      "sha256": "fc723dce3005fb2d16fe6df2e20a116f361b2b2b82b4aff7045c186c55190c27"
    }
  ],
  "provenance_chain": [
    {
      "step": "generate",
      "actor": "agent:codex",
      "source": "agent-created-pilot",
      "timestamp": "2026-08-14T00:00:00Z"
    },
    {
      "step": "runtime-test",
      "actor": "runtime:motionloom",
      "source": "internal-runtime-evidence",
      "timestamp": "2026-08-14T00:00:00Z"
    }
  ],
  "runtime_evidence": {
    "status": "pass",
    "runtime": "motionloom-body-rig-runtime",
    "tested_at": "2026-08-14T00:00:00Z",
    "evidence_path": "runtime-evidence.json"
  }
}
