{
  "schema_version": "1.0",
  "provenance_id": "hero-motion-pilot-provenance",
  "task_id": "artifact-intake-example",
  "scene": "hero-walk-fixture",
  "created_at": "2026-08-15T00:00:00Z",
  "asset": {"id": "character/hero-male", "path": "examples/agent-consumer/asset-consistency/assets/hero-frame-00.png", "type": "runtime-pilot", "framework": "body-rig"},
  "authority": "ai_generated",
  "readiness": "runtime_ready",
  "generator": {"model": "fixture-model", "task_id": "artifact-intake-example", "source": "fixture.local-artifact-intake", "generated_at": "2026-08-15T00:00:00Z"},
  "license": {"spdx": "UNLICENSED", "source": "MotionLoom fixture", "attribution": "not required"},
  "files": [
    {"path": "examples/agent-consumer/asset-consistency/assets/hero-frame-00.png", "role": "frame-00", "sha256": "75ce90653a01a23bcfab1aef83647d6364d3edbf6e4a44b84c635338c12b9248"},
    {"path": "examples/agent-consumer/asset-consistency/assets/hero-frame-01.png", "role": "frame-01", "sha256": "1eaf21df83ed49e490ceb7db1e1a14c58e5227bcb4f1fd79a70e8ad3ee7d38ad"},
    {"path": "examples/agent-consumer/asset-consistency/assets/hero-frame-02.png", "role": "frame-02", "sha256": "de88659cb7a57ae9c10b6e3e84e04e54bdc07e9971d5c42160a315d41b38fbc3"},
    {"path": "examples/agent-consumer/asset-consistency/assets/hero-frame-03.png", "role": "frame-03", "sha256": "161d906dc850cd3d3ee970b97406fc36bcdf1c34222ac94171a05672bf64d957"}
  ],
  "provenance_chain": [{"step": "generate", "actor": "fixture:local-artifact-intake", "source": "MotionLoom regression fixture", "timestamp": "2026-08-15T00:00:00Z"}],
  "runtime_evidence": {"status": "not_run", "runtime": "fixture-only", "tested_at": "2026-08-15T00:00:00Z"}
}
