{
  "schema_version": "1.0",
  "provenance_id": "runtime-pilot-framer-provenance",
  "task_id": "runtime-pilot-001",
  "scene": "runtime-pilot-framer",
  "created_at": "2026-08-15T00:00:00Z",
  "asset": {
    "id": "runtime/framer-motion-pilot",
    "path": "src/output/runtime-pilot-framer/scene.jsx",
    "type": "runtime_scene",
    "framework": "framer-motion",
    "version": "13.1.0"
  },
  "authority": "code_authored",
  "readiness": "review_required",
  "license": {
    "spdx": "MIT",
    "source": "MotionLoom repository source",
    "attribution": "MotionLoom contributors"
  },
  "files": [
    {
      "path": "src/output/runtime-pilot-framer/scene.jsx",
      "role": "runtime-source",
      "sha256": "f4c0e56de842cae6b234566b556e4f07154f8109dde382a474218a9de8b45a8b",
      "bytes": 1769
    }
  ],
  "provenance_chain": [
    {
      "step": "code-authoring",
      "actor": "MotionLoom runtime-pilot author",
      "source": "src/output/runtime-pilot-framer/scene.jsx",
      "timestamp": "2026-08-15T00:00:00Z",
      "sha256": "f4c0e56de842cae6b234566b556e4f07154f8109dde382a474218a9de8b45a8b"
    }
  ]
}
